{
  "schema_version": "1.0",
  "company": "宁夏宝丰能源集团股份有限公司",
  "ticker": "600989.SH",
  "market": "A-share",
  "period": "2026H1",
  "as_of": "2026-09-07",
  "reporting_basis": "consolidated",
  "currency": "CNY",
  "latest_reported_period": "2026H1",
  "latest_report_publication_date": "2026-08-13",
  "datapoints": [
    {
      "metric": "revenue",
      "value": 29135511197.96,
      "unit": "CNY",
      "currency": "CNY",
      "period": "FY2023",
      "basis": "consolidated",
      "source": "iFinD MCP licensed dataset; retrieved 2026-09-06",
      "source_tier": 2,
      "evidence_id": "E001"
    },
    {
      "metric": "net_income",
      "value": 5650614862.71,
      "unit": "CNY",
      "currency": "CNY",
      "period": "FY2023",
      "basis": "consolidated",
      "source": "iFinD MCP licensed dataset; retrieved 2026-09-06",
      "source_tier": 2,
      "evidence_id": "E002"
    },
    {
      "metric": "gross_profit",
      "value": 8856519735.4,
      "unit": "CNY",
      "currency": "CNY",
      "period": "FY2023",
      "basis": "consolidated",
      "source": "iFinD MCP licensed dataset; retrieved 2026-09-06",
      "source_tier": 2,
      "evidence_id": "E003"
    },
    {
      "metric": "cfo",
      "value": 8692623772.83,
      "unit": "CNY",
      "currency": "CNY",
      "period": "FY2023",
      "basis": "consolidated",
      "source": "iFinD MCP licensed dataset; retrieved 2026-09-06",
      "source_tier": 2,
      "evidence_id": "E004"
    },
    {
      "metric": "eps",
      "value": 0.77,
      "unit": "CNY/share",
      "currency": "CNY",
      "period": "FY2023",
      "basis": "consolidated",
      "source": "iFinD MCP licensed dataset; retrieved 2026-09-06",
      "source_tier": 2,
      "evidence_id": "E005"
    },
    {
      "metric": "revenue",
      "value": 32982889902.49,
      "unit": "CNY",
      "currency": "CNY",
      "period": "FY2024",
      "basis": "consolidated",
      "source": "iFinD MCP licensed dataset; retrieved 2026-09-06",
      "source_tier": 2,
      "evidence_id": "E006"
    },
    {
      "metric": "net_income",
      "value": 6337676311.63,
      "unit": "CNY",
      "currency": "CNY",
      "period": "FY2024",
      "basis": "consolidated",
      "source": "iFinD MCP licensed dataset; retrieved 2026-09-06",
      "source_tier": 2,
      "evidence_id": "E007"
    },
    {
      "metric": "gross_profit",
      "value": 10932724619.9,
      "unit": "CNY",
      "currency": "CNY",
      "period": "FY2024",
      "basis": "consolidated",
      "source": "iFinD MCP licensed dataset; retrieved 2026-09-06",
      "source_tier": 2,
      "evidence_id": "E008"
    },
    {
      "metric": "cfo",
      "value": 8897635369.03,
      "unit": "CNY",
      "currency": "CNY",
      "period": "FY2024",
      "basis": "consolidated",
      "source": "iFinD MCP licensed dataset; retrieved 2026-09-06",
      "source_tier": 2,
      "evidence_id": "E009"
    },
    {
      "metric": "eps",
      "value": 0.87,
      "unit": "CNY/share",
      "currency": "CNY",
      "period": "FY2024",
      "basis": "consolidated",
      "source": "iFinD MCP licensed dataset; retrieved 2026-09-06",
      "source_tier": 2,
      "evidence_id": "E010"
    },
    {
      "metric": "revenue",
      "value": 48037593136.78,
      "unit": "CNY",
      "currency": "CNY",
      "period": "FY2025",
      "basis": "consolidated",
      "source": "iFinD MCP licensed dataset; retrieved 2026-09-06",
      "source_tier": 2,
      "evidence_id": "E011"
    },
    {
      "metric": "net_income",
      "value": 11350295509.65,
      "unit": "CNY",
      "currency": "CNY",
      "period": "FY2025",
      "basis": "consolidated",
      "source": "iFinD MCP licensed dataset; retrieved 2026-09-06",
      "source_tier": 2,
      "evidence_id": "E012"
    },
    {
      "metric": "gross_profit",
      "value": 17253144364.28,
      "unit": "CNY",
      "currency": "CNY",
      "period": "FY2025",
      "basis": "consolidated",
      "source": "iFinD MCP licensed dataset; retrieved 2026-09-06",
      "source_tier": 2,
      "evidence_id": "E013"
    },
    {
      "metric": "cfo",
      "value": 16851078343.67,
      "unit": "CNY",
      "currency": "CNY",
      "period": "FY2025",
      "basis": "consolidated",
      "source": "iFinD MCP licensed dataset; retrieved 2026-09-06",
      "source_tier": 2,
      "evidence_id": "E014"
    },
    {
      "metric": "eps",
      "value": 1.56,
      "unit": "CNY/share",
      "currency": "CNY",
      "period": "FY2025",
      "basis": "consolidated",
      "source": "iFinD MCP licensed dataset; retrieved 2026-09-06",
      "source_tier": 2,
      "evidence_id": "E015"
    },
    {
      "metric": "revenue",
      "value": 7377425714.67,
      "unit": "CNY",
      "currency": "CNY",
      "period": "2024Q3",
      "basis": "consolidated",
      "source": "iFinD MCP licensed dataset; retrieved 2026-09-06",
      "source_tier": 2,
      "evidence_id": "E016"
    },
    {
      "metric": "net_income",
      "value": 1232101600.42,
      "unit": "CNY",
      "currency": "CNY",
      "period": "2024Q3",
      "basis": "consolidated",
      "source": "iFinD MCP licensed dataset; retrieved 2026-09-06",
      "source_tier": 2,
      "evidence_id": "E017"
    },
    {
      "metric": "gross_profit",
      "value": 2517262333.09,
      "unit": "CNY",
      "currency": "CNY",
      "period": "2024Q3",
      "basis": "consolidated",
      "source": "iFinD MCP licensed dataset; retrieved 2026-09-06",
      "source_tier": 2,
      "evidence_id": "E018"
    },
    {
      "metric": "cfo",
      "value": 1634193219.27,
      "unit": "CNY",
      "currency": "CNY",
      "period": "2024Q3",
      "basis": "consolidated",
      "source": "iFinD MCP licensed dataset; retrieved 2026-09-06",
      "source_tier": 2,
      "evidence_id": "E019"
    },
    {
      "metric": "revenue",
      "value": 8708325898.16,
      "unit": "CNY",
      "currency": "CNY",
      "period": "2024Q4",
      "basis": "consolidated",
      "source": "iFinD MCP licensed dataset; retrieved 2026-09-06",
      "source_tier": 2,
      "evidence_id": "E020"
    },
    {
      "metric": "net_income",
      "value": 1800885906.83,
      "unit": "CNY",
      "currency": "CNY",
      "period": "2024Q4",
      "basis": "consolidated",
      "source": "iFinD MCP licensed dataset; retrieved 2026-09-06",
      "source_tier": 2,
      "evidence_id": "E021"
    },
    {
      "metric": "gross_profit",
      "value": 2738045091.0,
      "unit": "CNY",
      "currency": "CNY",
      "period": "2024Q4",
      "basis": "consolidated",
      "source": "iFinD MCP licensed dataset; retrieved 2026-09-06",
      "source_tier": 2,
      "evidence_id": "E022"
    },
    {
      "metric": "cfo",
      "value": 3118086869.39,
      "unit": "CNY",
      "currency": "CNY",
      "period": "2024Q4",
      "basis": "consolidated",
      "source": "iFinD MCP licensed dataset; retrieved 2026-09-06",
      "source_tier": 2,
      "evidence_id": "E023"
    },
    {
      "metric": "revenue",
      "value": 10770741271.32,
      "unit": "CNY",
      "currency": "CNY",
      "period": "2025Q1",
      "basis": "consolidated",
      "source": "iFinD MCP licensed dataset; retrieved 2026-09-06",
      "source_tier": 2,
      "evidence_id": "E024"
    },
    {
      "metric": "net_income",
      "value": 2436717409.01,
      "unit": "CNY",
      "currency": "CNY",
      "period": "2025Q1",
      "basis": "consolidated",
      "source": "iFinD MCP licensed dataset; retrieved 2026-09-06",
      "source_tier": 2,
      "evidence_id": "E025"
    },
    {
      "metric": "gross_profit",
      "value": 3808848482.8,
      "unit": "CNY",
      "currency": "CNY",
      "period": "2025Q1",
      "basis": "consolidated",
      "source": "iFinD MCP licensed dataset; retrieved 2026-09-06",
      "source_tier": 2,
      "evidence_id": "E026"
    },
    {
      "metric": "cfo",
      "value": 3417082722.16,
      "unit": "CNY",
      "currency": "CNY",
      "period": "2025Q1",
      "basis": "consolidated",
      "source": "iFinD MCP licensed dataset; retrieved 2026-09-06",
      "source_tier": 2,
      "evidence_id": "E027"
    },
    {
      "metric": "revenue",
      "value": 12048802067.83,
      "unit": "CNY",
      "currency": "CNY",
      "period": "2025Q2",
      "basis": "consolidated",
      "source": "iFinD MCP licensed dataset; retrieved 2026-09-06",
      "source_tier": 2,
      "evidence_id": "E028"
    },
    {
      "metric": "net_income",
      "value": 3280908466.87,
      "unit": "CNY",
      "currency": "CNY",
      "period": "2025Q2",
      "basis": "consolidated",
      "source": "iFinD MCP licensed dataset; retrieved 2026-09-06",
      "source_tier": 2,
      "evidence_id": "E029"
    },
    {
      "metric": "gross_profit",
      "value": 4574331298.57,
      "unit": "CNY",
      "currency": "CNY",
      "period": "2025Q2",
      "basis": "consolidated",
      "source": "iFinD MCP licensed dataset; retrieved 2026-09-06",
      "source_tier": 2,
      "evidence_id": "E030"
    },
    {
      "metric": "cfo",
      "value": 4572726204.32,
      "unit": "CNY",
      "currency": "CNY",
      "period": "2025Q2",
      "basis": "consolidated",
      "source": "iFinD MCP licensed dataset; retrieved 2026-09-06",
      "source_tier": 2,
      "evidence_id": "E031"
    },
    {
      "metric": "revenue",
      "value": 12725335447.14,
      "unit": "CNY",
      "currency": "CNY",
      "period": "2025Q3",
      "basis": "consolidated",
      "source": "iFinD MCP licensed dataset; retrieved 2026-09-06",
      "source_tier": 2,
      "evidence_id": "E032"
    },
    {
      "metric": "net_income",
      "value": 3232261154.84,
      "unit": "CNY",
      "currency": "CNY",
      "period": "2025Q3",
      "basis": "consolidated",
      "source": "iFinD MCP licensed dataset; retrieved 2026-09-06",
      "source_tier": 2,
      "evidence_id": "E033"